{
  "schema_version": 1,
  "id": "00000000-0000-4000-8000-000000000001",
  "title": "Hymn of Thanks",
  "arrangements": [
    {
      "id": "00000000-0000-4000-8000-000000000002",
      "name": "Default",
      "content_sha256": "d96a332e7a9041b8f874d4860bed8cd2603238843479b12f4e25581b8b595e2d",
      "slides": [
        {
          "id": "00000000-0000-4000-8000-000000000003",
          "lines": [
            "Salamat, Ginoo"
          ]
        }
      ],
      "sequence": [
        "00000000-0000-4000-8000-000000000003"
      ]
    }
  ]
}
