{
  "schema_version": 1,
  "id": "00000000-0000-4000-8000-000000000010",
  "title": "Salamat, Ginoo",
  "aliases": [
    "Thanksgiving Hymn",
    "Salamat Ginoo"
  ],
  "composer": "Sample Composer",
  "source": "Parish binder 2019, p. 14",
  "language": "tl",
  "arrangements": [
    {
      "id": "00000000-0000-4000-8000-000000000011",
      "name": "Tagalog - Adult Choir",
      "language": "tl",
      "choirs": [
        "Adult Choir"
      ],
      "occasions": [
        "Easter",
        "Ordinary Time"
      ],
      "content_sha256": "f9246d4d49f320754b5b693dbf835965f3efe6179ba0d18e7189e7f3b4a001ef",
      "slides": [
        {
          "id": "00000000-0000-4000-8000-000000000020",
          "label": "Verse 1",
          "lines": [
            "Salamat po, Panginoon",
            "sa dakila mong biyaya"
          ]
        },
        {
          "id": "00000000-0000-4000-8000-000000000021",
          "label": "Refrain",
          "lines": [
            "Salamat, salamat,",
            "Ginoo kong mahal"
          ]
        }
      ],
      "sequence": [
        "00000000-0000-4000-8000-000000000020",
        "00000000-0000-4000-8000-000000000021",
        "00000000-0000-4000-8000-000000000020",
        "00000000-0000-4000-8000-000000000021"
      ]
    },
    {
      "id": "00000000-0000-4000-8000-000000000012",
      "name": "Cebuano - Youth Choir",
      "language": "ceb",
      "choirs": [
        "Youth Choir"
      ],
      "occasions": [],
      "content_sha256": "37564b278ccba991173ee382212f23074b71732775afc0e2d8862d5f103a4e38",
      "slides": [
        {
          "id": "00000000-0000-4000-8000-000000000030",
          "label": "Verse 1",
          "lines": [
            "Salamat, Ginoo, sa imong gugma"
          ]
        },
        {
          "id": "00000000-0000-4000-8000-000000000031",
          "lines": [
            "Ang imong kaayo di mahurot"
          ]
        }
      ],
      "sequence": [
        "00000000-0000-4000-8000-000000000030",
        "00000000-0000-4000-8000-000000000031"
      ]
    }
  ]
}
